timestamp_inicio;timestamp_fim;codigo_empresa;razao_social;cnpj;segmento;status;motivo;tentativas
2026-03-02 10:47:20;2026-03-02 10:49:42;833;A. B. S. REPRESENTACOES;41.570.055.0001-14;SERVIÇO;SUCESSO;OK;1
2026-03-02 10:49:42;2026-03-02 10:54:12;164;A. C. J. COM. SUCATAS LTDA (manda  arquivo)  [DARF GONÇALO];02.873.934.0001-63;COMÉRCIO;SUCESSO_SEM_COMPETENCIA;Sem notas na competencia alvo;1
2026-03-02 10:54:12;2026-03-02 10:55:08;115;A. E. GUEDES COMERCIO [manda arquivo];30.792.052.0001-09;COMÉRCIO/SERVIÇO;SUCESSO_SEM_COMPETENCIA;Sem notas na competencia alvo;1
2026-03-02 10:55:08;2026-03-02 10:56:34;554;A. L. G. PEREIRA;24.125.988.0001-83;SERVIÇO;SUCESSO;OK;1
2026-03-02 10:56:34;2026-03-02 10:56:42;913;A. P. G. COM. - FILIAL - MG - UBERLANDIA    MANDAR NO WHATS;14.128.421.0003-79;COMÉRCIO;SUCESSO;Revisar manualmente: credencial inválida (usuário/senha) no portal;1
2026-03-02 10:56:42;2026-03-02 10:56:50;413;A. P. G. COM. COL. LTDA (manda  arquivo) MANDAR NO WHATS;14.128.421.0001-07;COMÉRCIO;SUCESSO_SEM_SERVICOS;Contribuinte sem modulo de Nota Fiscal;1
2026-03-02 10:56:50;2026-03-02 10:57:01;1008;A. P. G. TOP 20 - [(MG) MATRIZ];58.150.107.0001-04;COMÉRCIO;FALHA;Falha execucao (exit=1);3
2026-03-02 10:57:01;2026-03-02 11:02:25;947;AKIKO OKA   (NOTA MANUAL);36.557.425.0001-43;COMÉRCIO/SERVIÇO;SUCESSO_SEM_COMPETENCIA;Sem notas na competencia alvo;1
2026-03-02 11:02:25;2026-03-02 11:04:08;901;ALEJANDRA DVZ;46.267.438.0001-31;SERVIÇO;SUCESSO;OK;1
2026-03-02 11:04:08;2026-03-02 11:04:16;926;ALESSANDRA PRADO LOJA (manda  arquivo) pegar pref.sp Tbm;35.665.896.0001-02;COMÉRCIO;SUCESSO;Revisar manualmente: credencial inválida (usuário/senha) no portal;1
2026-03-02 11:04:16;2026-03-02 11:04:24;1042;ALESSANDRA PRADO TRADUÇÃO   pegar pref.sp Tbm;62.963.591.0001-50;SERVIÇO;SUCESSO;Revisar manualmente: credencial inválida (usuário/senha) no portal;1
2026-03-02 11:04:24;2026-03-02 11:05:40;366;ALLFISIO LTDA ME;11.426.622.0001-00;SERVIÇO;SUCESSO;OK;1
2026-03-02 11:05:40;2026-03-02 11:05:51;1067;AMANTINI E LAMONICA TREIN. SERV.;62.891.485.0001-08;COMÉRCIO/SERVIÇO;FALHA;Falha execucao (exit=1);3
2026-03-02 11:05:51;2026-03-02 11:06:37;940;ANTONELO TEXTIL IMPORT. E EXP. (05) ver se ñ tem nd em aberto;53.428.965.0001-46;COMÉRCIO;SUCESSO_SEM_COMPETENCIA;Sem notas na competencia alvo;1
2026-03-02 11:06:37;2026-03-02 11:07:58;823;ARAUJO & REHDER ASSESSORIA EM PESQUISA E;41.316.446.0001-07;SERVIÇO;SUCESSO;OK;1
2026-03-02 11:07:58;2026-03-02 11:08:05;1052;AUR4;59.555.872.0001-69;SERVIÇO;SUCESSO;Revisar manualmente: credencial inválida (usuário/senha) no portal;1
2026-03-02 11:08:05;2026-03-02 11:08:58;1002;B H S CAMARGO TRANSPORTES;37.329.920.0001-68;SERVIÇO;SUCESSO_SEM_COMPETENCIA;Sem notas na competencia alvo;1
2026-03-02 11:08:58;2026-03-02 11:10:07;754;B. I. VALLE CAFETERIA EIRELI;16.579.694.0001-01;-;SUCESSO_SEM_COMPETENCIA;Sem notas na competencia alvo;1
2026-03-02 11:10:07;2026-03-02 11:12:33;395;BASE PROMO C. LTDA;13.619.319.0001-41;SERVIÇO;SUCESSO;OK;1
2026-03-02 11:12:33;2026-03-02 11:13:23;541;BAURUPRATIK;15.426.649.0001-46;SERVIÇO;SUCESSO_SEM_COMPETENCIA;Sem notas na competencia alvo;1
2026-03-02 11:13:23;2026-03-02 11:15:36;726;BAVUSO E MARRI;33.598.338.0001-46;SERVIÇO;SUCESSO;OK;1
2026-03-02 11:15:36;2026-03-02 11:15:46;887;BERBELLA LTDA - MAIS QUE BOLO (manda  arquivo);44.871.615.0001-69;COMÉRCIO;SUCESSO_SEM_SERVICOS;Contribuinte sem modulo de Nota Fiscal;1
2026-03-02 11:15:46;2026-03-02 11:15:54;959;BFS COMÉRCIO (manda  arquivo);52.014.128.0001-08;COMÉRCIO;SUCESSO_SEM_SERVICOS;Contribuinte sem modulo de Nota Fiscal;1
2026-03-02 11:15:54;2026-03-02 11:16:35;1045;BGC SOLUÇÕES EMPR.;38.478831.0001-46;COMÉRCIO/SERVIÇO;SUCESSO_SEM_COMPETENCIA;Sem notas na competencia alvo;1
2026-03-02 11:16:35;2026-03-02 11:19:26;388;BOZZINI EVENTOS EIRELI (NOTA MANUAL);12.127.713.0001-08;SERVIÇO;SUCESSO_SEM_COMPETENCIA;Sem notas na competencia alvo;1
2026-03-02 11:19:26;2026-03-02 11:20:16;960;C L INVESTIMENTOS (mandar pelo whats);49.890.107.0001-41;SERVIÇO;SUCESSO_SEM_COMPETENCIA;Sem notas na competencia alvo;1
2026-03-02 11:20:16;2026-03-02 11:21:31;839;C.A.G.R ENGENHARIA;41.677.370.0001-45;SERVIÇO;SUCESSO;OK;1
2026-03-02 11:21:31;2026-03-02 11:23:20;733;CAIO LORENZO AC. SOC   [REINF];34.443.623.0001-50;SERVIÇO;SUCESSO;OK;1
2026-03-02 11:23:20;2026-03-02 11:23:32;1047;CAMILA SILVA SIECOLA COUBE;35.175.113.0001-02;COMÉRCIO/SERVIÇO;FALHA;Falha execucao (exit=1);3
2026-03-02 11:23:32;2026-03-02 11:24:54;85;CARDOZO E COZZA (procuração simão);27.645.370.0001-32;SERVIÇO;SUCESSO;OK;1
2026-03-02 11:24:54;2026-03-02 11:27:06;47;CASA DO CIRCO;10.497.112.0001-53;SERVIÇO;SUCESSO;OK;1
2026-03-02 11:27:06;2026-03-02 11:28:26;50;CELIO AMARAL S. IND. ADV;26.245.203.0001-31;SERVIÇO;SUCESSO;OK;1
2026-03-02 11:28:26;2026-03-02 11:29:31;434;CENTRO T.CORPO ALMA [ALUGUEL REINF];15.664.810.0001-10;SERVIÇO;SUCESSO_SEM_COMPETENCIA;Sem notas na competencia alvo;1
2026-03-02 11:29:31;2026-03-02 11:31:05;244;CINCOESSES (mandar WHATS) (manda  arquivo) [REINF];07.891.239.0001-48;COMÉRCIO/SERVIÇO;SUCESSO_SEM_COMPETENCIA;Sem notas na competencia alvo;1
2026-03-02 11:31:05;2026-03-02 11:33:05;167;CONSTRUFIC CONST [REINF] [DARF CHAFIC];03.222.292.0001-03;SERVIÇO;SUCESSO;OK;2
2026-03-02 11:33:05;2026-03-02 11:34:26;824;CONTI  & CASTRO ASSESSORIA PESQ. ODONT;41.273.476.0001-83;SERVIÇO;SUCESSO;OK;1
2026-03-02 11:34:26;2026-03-02 11:36:34;812;CORREA& SANCHES;40.525.231.0001-33;SERVIÇO;SUCESSO;OK;1
2026-03-02 11:36:34;2026-03-02 11:36:42;737;COSTA & SOARES C.FRUTAS (passa valor fat);35.018.426.0001-57;COMÉRCIO/SERVIÇO;SUCESSO;Revisar manualmente: credencial inválida (usuário/senha) no portal;1
2026-03-02 11:36:42;2026-03-02 11:37:58;952;CS SERVIÇOS E MANUT. EM TRANSFORMADORES;51.458.514.0001-26;SERVIÇO;SUCESSO_SEM_COMPETENCIA;Sem notas na competencia alvo;1
2026-03-02 11:37:58;2026-03-02 11:38:06;911;D. A. J. MATOZO RECICLA - TUIM SUCATAS;46.963.185.0001-30;COMÉRCIO;SUCESSO_SEM_SERVICOS;Contribuinte sem modulo de Nota Fiscal;1
2026-03-02 11:38:06;2026-03-02 11:39:21;878;D. CASA - M.A . LEME REST (manda  arquivo);38.239.874.0001-79;COMÉRCIO;SUCESSO_SEM_COMPETENCIA;Sem notas na competencia alvo;1
2026-03-02 11:39:21;2026-03-02 11:40:28;337;DAMIATI SERV. CAD;10.789.546.0001-27;SERVIÇO;SUCESSO_SEM_COMPETENCIA;Sem notas na competencia alvo;1
2026-03-02 11:40:28;2026-03-02 11:40:39;1048;DANIEL COUBE SCHAFRANSKI;58.554.897.0001-85;COMÉRCIO;FALHA;Falha execucao (exit=1);3
2026-03-02 11:40:39;2026-03-02 11:41:56;160;DESPACHANTE DOC VICENTINI;45.023.959.0001-80;SERVIÇO;SUCESSO;OK;1
2026-03-02 11:41:56;2026-03-02 11:42:09;825;DGWX SOLUÇOES (manda  arquivo);40.768.237.0001-31;SERVIÇO;SUCESSO;Revisar manualmente: credencial inválida (usuário/senha) no portal;1
2026-03-02 11:42:09;2026-03-02 11:42:18;1006;DIGLACE SORVETE ARTESANAL E NATURAL E CONFEITARIA;58.070.123.0001-89;COMÉRCIO;SUCESSO_SEM_SERVICOS;Contribuinte sem modulo de Nota Fiscal;1
2026-03-02 11:42:18;2026-03-02 11:44:00;943;E P I D FONOAUDIOLOGIA LTDA;50.157.244.0001-50;SERVIÇO;SUCESSO;OK;1
2026-03-02 11:45:23;2026-03-02 11:45:42;995;EMANUEL S SOARES DE LIMA IMOVEIS;32.758.363.0001-87;SERVIÇO;FALHA;Captcha nao resolvido a tempo;3
2026-03-02 11:45:42;2026-03-02 11:45:54;89;EME CULTURAL;20.347.725.0001-68;SERVIÇO;SUCESSO;Revisar manualmente: credencial inválida (usuário/senha) no portal;1
2026-03-02 11:45:54;2026-03-02 11:46:01;967;EME LABORATORIO DE MÚSICA;52.848.362.0001-30;SERVIÇO;SUCESSO;Revisar manualmente: credencial inválida (usuário/senha) no portal;1
2026-03-02 11:46:01;2026-03-02 11:46:33;249;EMPORIUM COM. ACRILICO;07.962.637.0001-08;COMÉRCIO;SUCESSO_SEM_COMPETENCIA;Sem notas na competencia alvo;1
2026-03-02 11:46:33;2026-03-02 11:46:51;790;ERCY NASCIMENTO;24.077.626.0001-64;SERVIÇO;SUCESSO_SEM_COMPETENCIA;Sem notas na competencia alvo;1
